{"catalog":{"content_sha256":"4444444444444444444444444444444444444444444444444444444444444444","item_count":90,"scope":"train_only"},"content_sha256":"abf5442d649fb30b0c1513b13c1c8482b8dbac69954833d38ce31ed9b0b81aa3","dataset_identity_sha256":"aaaaaaaaaaaaaaaaaaaaaaaaaaaaaaaaaaaaaaaaaaaaaaaaaaaaaaaaaaaaaaaa","descriptor_id":"external-vg-frozen","evaluation":{"cutoff":10,"publication_depth":100,"slices":[{"definition_sha256":"5555555555555555555555555555555555555555555555555555555555555555","slice_id":"gap_gt_365d"},{"definition_sha256":"6666666666666666666666666666666666666666666666666666666666666666","slice_id":"overall"}]},"privacy":{"absolute_private_paths_exported":false,"policy_sha256":"7777777777777777777777777777777777777777777777777777777777777777","source_item_ids_exported":false,"source_user_ids_exported":false},"producer":{"name":"third-party.example","version":"0.1.0"},"schema":"sidscope.dataset_profile_descriptor.v1","schema_revision":"1.0.0","split_bindings":[{"content_sha256":"1111111111111111111111111111111111111111111111111111111111111111","role":"train","row_count":100},{"content_sha256":"2222222222222222222222222222222222222222222222222222222222222222","role":"validation","row_count":20},{"content_sha256":"3333333333333333333333333333333333333333333333333333333333333333","role":"test","row_count":25}],"target_universe":{"content_sha256":"bbbbbbbbbbbbbbbbbbbbbbbbbbbbbbbbbbbbbbbbbbbbbbbbbbbbbbbbbbbbbbbb","item_count":25,"scope":"evaluation_targets"}}
